{
  "schemaVersion": "1.0",
  "toolVersion": "0.1.0",
  "catalogVersion": "2026.10.20",
  "catalogDigest": "7bb85b77cf4e668f04a323258897959487f082df698cb85ed744a9caee1ae5db",
  "collectedAt": "2026-10-20T12:00:00.000Z",
  "synthetic": true,
  "target": {
    "platform": "cloud",
    "context": "demo-cloud",
    "subscription": "00000000-0000-0000-0000-000000000001",
    "resourceGroup": "rg-xray-demo",
    "cluster": "xray-demo"
  },
  "scope": {
    "categories": [
      "control-plane",
      "identity",
      "nodes",
      "networking",
      "security",
      "workloads",
      "reliability",
      "storage",
      "observability",
      "governance",
      "cost",
      "lifecycle",
      "business-continuity",
      "azure-local",
      "active-validation"
    ],
    "namespaces": null,
    "excludedNamespaces": [
      "kube-system",
      "kube-public",
      "kube-node-lease"
    ],
    "profile": "production"
  },
  "sources": {
    "context": {
      "status": "ok",
      "collectedAt": "2026-10-20T12:00:00.000Z",
      "durationMs": 0,
      "commands": [],
      "data": {
        "server": "https://aks-xray-demo.example.invalid"
      }
    },
    "cluster": {
      "status": "ok",
      "collectedAt": "2026-10-20T12:00:00.000Z",
      "durationMs": 0,
      "commands": [],
      "data": {
        "id": "/subscriptions/00000000-0000-0000-0000-000000000001/resourceGroups/rg-xray-demo/providers/Microsoft.ContainerService/managedClusters/xray-demo",
        "name": "xray-demo",
        "type": "Microsoft.ContainerService/managedClusters",
        "location": "eastus2",
        "kubernetesVersion": "1.34.1",
        "currentKubernetesVersion": "1.34.1",
        "fqdn": "aks-xray-demo.example.invalid",
        "disableLocalAccounts": true,
        "enableRBAC": true,
        "sku": {
          "name": "Base",
          "tier": "Standard"
        },
        "aadProfile": {
          "managed": true
        },
        "apiServerAccessProfile": {
          "enablePrivateCluster": false,
          "authorizedIpRanges": [
            "203.0.113.0/24"
          ]
        },
        "networkProfile": {
          "networkPlugin": "azure",
          "networkPluginMode": "overlay",
          "networkDataplane": "cilium",
          "podCidr": "10.244.0.0/16",
          "serviceCidr": "10.0.0.0/16",
          "dnsServiceIP": "10.0.0.10",
          "outboundType": "userDefinedRouting"
        },
        "oidcIssuerProfile": {
          "enabled": true
        },
        "securityProfile": {
          "workloadIdentity": {
            "enabled": true
          },
          "defender": {
            "securityMonitoring": {
              "enabled": true
            }
          }
        },
        "azureMonitorProfile": {
          "metrics": {
            "enabled": true
          }
        },
        "addonProfiles": {
          "azurepolicy": {
            "enabled": true
          },
          "omsagent": {
            "enabled": false
          }
        },
        "autoUpgradeProfile": {
          "upgradeChannel": "stable",
          "nodeOSUpgradeChannel": "NodeImage"
        },
        "nodeProvisioningProfile": {
          "mode": "Manual"
        }
      }
    },
    "clusterrolebindings": {
      "status": "ok",
      "collectedAt": "2026-10-20T12:00:00.000Z",
      "durationMs": 0,
      "commands": [],
      "data": {
        "items": [
          {
            "kind": "ClusterRoleBinding",
            "metadata": {
              "name": "demo-break-glass"
            },
            "roleRef": {
              "kind": "ClusterRole",
              "name": "cluster-admin"
            },
            "subjects": [
              {
                "kind": "Group",
                "name": "demo-privileged-operators"
              }
            ]
          }
        ]
      }
    },
    "deployments": {
      "status": "ok",
      "collectedAt": "2026-10-20T12:00:00.000Z",
      "durationMs": 0,
      "commands": [],
      "data": {
        "items": [
          {
            "kind": "Deployment",
            "metadata": {
              "name": "checkout",
              "namespace": "payments",
              "generation": 1,
              "labels": {
                "app": "checkout"
              }
            },
            "replicas": 2,
            "observedGeneration": 1,
            "availableReplicas": 1,
            "pod": {
              "labels": {
                "app": "checkout"
              },
              "spec": {
                "nodeName": "demo-node-1",
                "nodeSelector": {
                  "kubernetes.io/os": "linux"
                },
                "serviceAccountName": "checkout",
                "securityContext": {
                  "runAsNonRoot": true,
                  "runAsUser": 10001,
                  "seccompProfile": {
                    "type": "RuntimeDefault"
                  }
                },
                "containers": [
                  {
                    "name": "checkout",
                    "image": "example.invalid/checkout:latest",
                    "resources": {
                      "requests": {
                        "cpu": "200m",
                        "memory": "256Mi"
                      },
                      "limits": {
                        "cpu": "100m",
                        "memory": "512Mi"
                      }
                    },
                    "securityContext": {
                      "allowPrivilegeEscalation": false,
                      "capabilities": {
                        "drop": [
                          "ALL"
                        ]
                      }
                    },
                    "probes": {
                      "readiness": true,
                      "liveness": true,
                      "startup": false
                    }
                  }
                ]
              }
            }
          }
        ]
      }
    },
    "statefulsets": {
      "status": "ok",
      "collectedAt": "2026-10-20T12:00:00.000Z",
      "durationMs": 0,
      "commands": [],
      "data": {
        "items": []
      }
    },
    "daemonsets": {
      "status": "ok",
      "collectedAt": "2026-10-20T12:00:00.000Z",
      "durationMs": 0,
      "commands": [],
      "data": {
        "items": []
      }
    },
    "jobs": {
      "status": "ok",
      "collectedAt": "2026-10-20T12:00:00.000Z",
      "durationMs": 0,
      "commands": [],
      "data": {
        "items": []
      }
    },
    "cronjobs": {
      "status": "ok",
      "collectedAt": "2026-10-20T12:00:00.000Z",
      "durationMs": 0,
      "commands": [],
      "data": {
        "items": []
      }
    },
    "pods": {
      "status": "ok",
      "collectedAt": "2026-10-20T12:00:00.000Z",
      "durationMs": 0,
      "commands": [],
      "data": {
        "items": [
          {
            "kind": "Pod",
            "metadata": {
              "name": "checkout-example",
              "namespace": "payments",
              "generation": 1,
              "labels": {
                "app": "checkout"
              },
              "ownerReferences": [
                {
                  "kind": "ReplicaSet",
                  "name": "checkout-example"
                }
              ]
            },
            "pod": {
              "labels": {
                "app": "checkout"
              },
              "spec": {
                "nodeName": "demo-node-1",
                "nodeSelector": {
                  "kubernetes.io/os": "linux"
                },
                "serviceAccountName": "checkout",
                "securityContext": {
                  "runAsNonRoot": true,
                  "runAsUser": 10001,
                  "seccompProfile": {
                    "type": "RuntimeDefault"
                  }
                },
                "containers": [
                  {
                    "name": "checkout",
                    "image": "example.invalid/checkout:latest",
                    "resources": {
                      "requests": {
                        "cpu": "200m",
                        "memory": "256Mi"
                      },
                      "limits": {
                        "cpu": "100m",
                        "memory": "512Mi"
                      }
                    },
                    "securityContext": {
                      "allowPrivilegeEscalation": false,
                      "capabilities": {
                        "drop": [
                          "ALL"
                        ]
                      }
                    },
                    "probes": {
                      "readiness": true,
                      "liveness": true,
                      "startup": false
                    }
                  }
                ]
              }
            },
            "phase": "Running",
            "containerStatuses": [
              {
                "name": "checkout",
                "ready": true,
                "restartCount": 0
              }
            ]
          }
        ]
      }
    },
    "namespaces": {
      "status": "ok",
      "collectedAt": "2026-10-20T12:00:00.000Z",
      "durationMs": 0,
      "commands": [],
      "data": {
        "items": [
          {
            "kind": "Namespace",
            "metadata": {
              "name": "payments",
              "labels": {
                "pod-security.kubernetes.io/enforce": "restricted"
              }
            }
          }
        ]
      }
    },
    "nodes": {
      "status": "ok",
      "collectedAt": "2026-10-20T12:00:00.000Z",
      "durationMs": 0,
      "commands": [],
      "data": {
        "items": [
          {
            "kind": "Node",
            "metadata": {
              "name": "demo-node-1",
              "labels": {
                "kubernetes.io/os": "linux"
              }
            },
            "conditions": [